{
  "slug": "cinemark-lar-center",
  "name": "Cinemark Lar Center",
  "network": {
    "slug": "cinemark",
    "name": "Cinemark"
  },
  "city": "São Paulo",
  "state": "SP",
  "neighborhood": "Vila Guilherme",
  "address": "Av. Otto Baumgart – Vila Guilherme",
  "ancine_registry": "30596",
  "last_verified": "2026-07-31",
  "rooms": [
    {
      "name": "Sala 1",
      "slug": "sala-1",
      "ancine_registry": "5005238",
      "technologies": [],
      "projection": {
        "technology": "A confirmar",
        "resolution": "4K",
        "light_source": "Laser",
        "brand": "Barco",
        "notes": "Barco 4K laser; ~30.000 lumens; tela 40% maior que convencional"
      },
      "screen": {
        "aspect_ratio": "A confirmar",
        "width_m": null,
        "height_m": null
      },
      "sound": {
        "format": "Multicanal",
        "channels": null,
        "speakers": 12,
        "power_watts": 50000,
        "notes": "Sistema surround 11.1; 50.000W; certificação THX",
        "channel_layout": "11.1"
      },
      "seats": 435,
      "accessibility": {
        "wheelchair_seats": 9,
        "reduced_mobility_seats": 5,
        "obese_seats": 10,
        "ramp_to_seats": true,
        "ramp_to_room": false,
        "accessible_restrooms": true
      },
      "sources": [
        {
          "type": "official",
          "url": "https://www.gov.br/ancine/pt-br/oca/cinema/arquivos.csv/salas-de-exibicao-e-complexos.csv/@@download/file",
          "note": "Cadastro mensal da ANCINE: \"CINEMARK LAR CENTER SALA 01\", registro 5005238, em funcionamento; 435 assentos, 9 espaços para cadeirantes, 5 assentos de mobilidade reduzida, 10 assentos para pessoas obesas."
        }
      ]
    },
    {
      "name": "Sala 2",
      "slug": "sala-2",
      "ancine_registry": "5005239",
      "technologies": [],
      "projection": {
        "technology": "A confirmar",
        "resolution": "A confirmar",
        "light_source": "A confirmar"
      },
      "screen": {
        "aspect_ratio": "A confirmar",
        "width_m": null,
        "height_m": null
      },
      "sound": {
        "format": "A confirmar",
        "channels": null,
        "speakers": null,
        "power_watts": null
      },
      "seats": 118,
      "accessibility": {
        "wheelchair_seats": 4,
        "reduced_mobility_seats": 1,
        "obese_seats": 2,
        "ramp_to_seats": true,
        "ramp_to_room": false,
        "accessible_restrooms": true
      },
      "sources": [
        {
          "type": "official",
          "url": "https://www.gov.br/ancine/pt-br/oca/cinema/arquivos.csv/salas-de-exibicao-e-complexos.csv/@@download/file",
          "note": "Cadastro mensal da ANCINE: \"CINEMARK LAR CENTER SALA 02\", registro 5005239, em funcionamento; 118 assentos, 4 espaços para cadeirantes, 1 assento de mobilidade reduzida, 2 assentos para pessoas obesas."
        }
      ]
    },
    {
      "name": "Sala 3",
      "slug": "sala-3",
      "ancine_registry": "5005240",
      "technologies": [],
      "projection": {
        "technology": "A confirmar",
        "resolution": "A confirmar",
        "light_source": "A confirmar"
      },
      "screen": {
        "aspect_ratio": "A confirmar",
        "width_m": null,
        "height_m": null
      },
      "sound": {
        "format": "A confirmar",
        "channels": null,
        "speakers": null,
        "power_watts": null
      },
      "seats": 118,
      "accessibility": {
        "wheelchair_seats": 4,
        "reduced_mobility_seats": 1,
        "obese_seats": 2,
        "ramp_to_seats": true,
        "ramp_to_room": false,
        "accessible_restrooms": true
      },
      "sources": [
        {
          "type": "official",
          "url": "https://www.gov.br/ancine/pt-br/oca/cinema/arquivos.csv/salas-de-exibicao-e-complexos.csv/@@download/file",
          "note": "Cadastro mensal da ANCINE: \"CINEMARK LAR CENTER SALA 03\", registro 5005240, em funcionamento; 118 assentos, 4 espaços para cadeirantes, 1 assento de mobilidade reduzida, 2 assentos para pessoas obesas."
        }
      ]
    }
  ]
}
