{
  "slug": "cinemark-shopping-iguatemi-sp",
  "name": "Cinemark Shopping Iguatemi SP",
  "network": {
    "slug": "cinemark",
    "name": "Cinemark"
  },
  "city": "São Paulo",
  "state": "SP",
  "neighborhood": "Jardim Paulista",
  "address": "Av. Brigadeiro Faria Lima – Jardim Paulista",
  "ancine_registry": "40182",
  "last_verified": "2026-07-31",
  "rooms": [
    {
      "name": "Sala 1",
      "slug": "sala-1",
      "ancine_registry": "5006047",
      "technologies": [],
      "projection": {
        "technology": "A confirmar",
        "resolution": "A confirmar",
        "light_source": "A confirmar"
      },
      "screen": {
        "aspect_ratio": "A confirmar",
        "width_m": null,
        "height_m": null
      },
      "sound": {
        "format": "A confirmar",
        "channels": null,
        "speakers": null,
        "power_watts": null
      },
      "seats": 275,
      "accessibility": {
        "wheelchair_seats": 6,
        "reduced_mobility_seats": 3,
        "obese_seats": 3,
        "ramp_to_seats": true,
        "ramp_to_room": false,
        "accessible_restrooms": true
      },
      "sources": [
        {
          "type": "official",
          "url": "https://www.gov.br/ancine/pt-br/oca/cinema/arquivos.csv/salas-de-exibicao-e-complexos.csv/@@download/file",
          "note": "Cadastro mensal da ANCINE: \"CINEMARK SHOPPING IGUATEMI SP SALA 01\", registro 5006047, em funcionamento; 275 assentos, 6 espaços para cadeirantes, 3 assentos de mobilidade reduzida, 3 assentos para pessoas obesas."
        }
      ]
    },
    {
      "name": "Sala 2",
      "slug": "sala-2",
      "ancine_registry": "5006048",
      "technologies": [],
      "projection": {
        "technology": "A confirmar",
        "resolution": "A confirmar",
        "light_source": "A confirmar"
      },
      "screen": {
        "aspect_ratio": "A confirmar",
        "width_m": null,
        "height_m": null
      },
      "sound": {
        "format": "A confirmar",
        "channels": null,
        "speakers": null,
        "power_watts": null
      },
      "seats": 135,
      "accessibility": {
        "wheelchair_seats": 3,
        "reduced_mobility_seats": 1,
        "obese_seats": 2,
        "ramp_to_seats": true,
        "ramp_to_room": false,
        "accessible_restrooms": true
      },
      "sources": [
        {
          "type": "official",
          "url": "https://www.gov.br/ancine/pt-br/oca/cinema/arquivos.csv/salas-de-exibicao-e-complexos.csv/@@download/file",
          "note": "Cadastro mensal da ANCINE: \"CINEMARK SHOPPING IGUATEMI SP SALA 02\", registro 5006048, em funcionamento; 135 assentos, 3 espaços para cadeirantes, 1 assento de mobilidade reduzida, 2 assentos para pessoas obesas."
        }
      ]
    },
    {
      "name": "Sala 3",
      "slug": "sala-3",
      "ancine_registry": "5006049",
      "technologies": [],
      "projection": {
        "technology": "A confirmar",
        "resolution": "A confirmar",
        "light_source": "A confirmar"
      },
      "screen": {
        "aspect_ratio": "A confirmar",
        "width_m": null,
        "height_m": null
      },
      "sound": {
        "format": "A confirmar",
        "channels": null,
        "speakers": null,
        "power_watts": null
      },
      "seats": 136,
      "accessibility": {
        "wheelchair_seats": 3,
        "reduced_mobility_seats": 1,
        "obese_seats": 2,
        "ramp_to_seats": true,
        "ramp_to_room": false,
        "accessible_restrooms": true
      },
      "sources": [
        {
          "type": "official",
          "url": "https://www.gov.br/ancine/pt-br/oca/cinema/arquivos.csv/salas-de-exibicao-e-complexos.csv/@@download/file",
          "note": "Cadastro mensal da ANCINE: \"CINEMARK SHOPPING IGUATEMI SP SALA 03\", registro 5006049, em funcionamento; 136 assentos, 3 espaços para cadeirantes, 1 assento de mobilidade reduzida, 2 assentos para pessoas obesas."
        }
      ]
    },
    {
      "name": "Sala 4",
      "slug": "sala-4",
      "ancine_registry": "5006050",
      "technologies": [],
      "projection": {
        "technology": "A confirmar",
        "resolution": "A confirmar",
        "light_source": "A confirmar"
      },
      "screen": {
        "aspect_ratio": "A confirmar",
        "width_m": null,
        "height_m": null
      },
      "sound": {
        "format": "A confirmar",
        "channels": null,
        "speakers": null,
        "power_watts": null
      },
      "seats": 147,
      "accessibility": {
        "wheelchair_seats": 3,
        "reduced_mobility_seats": 1,
        "obese_seats": 2,
        "ramp_to_seats": false,
        "ramp_to_room": false,
        "accessible_restrooms": false
      },
      "sources": [
        {
          "type": "official",
          "url": "https://www.gov.br/ancine/pt-br/oca/cinema/arquivos.csv/salas-de-exibicao-e-complexos.csv/@@download/file",
          "note": "Cadastro mensal da ANCINE: \"CINEMARK SHOPPING IGUATEMI SP SALA 04\", registro 5006050, em funcionamento; 147 assentos, 3 espaços para cadeirantes, 1 assento de mobilidade reduzida, 2 assentos para pessoas obesas."
        }
      ]
    },
    {
      "name": "Sala 5",
      "slug": "sala-5-vip",
      "room_type": "VIP",
      "ancine_registry": "5006051",
      "technologies": [],
      "projection": {
        "technology": "A confirmar",
        "resolution": "A confirmar",
        "light_source": "Laser"
      },
      "screen": {
        "aspect_ratio": "A confirmar",
        "width_m": null,
        "height_m": null
      },
      "sound": {
        "format": "A confirmar",
        "channels": null,
        "speakers": null,
        "power_watts": null
      },
      "seats": 66,
      "accessibility": {
        "wheelchair_seats": 3,
        "reduced_mobility_seats": 1,
        "obese_seats": 1,
        "ramp_to_seats": true,
        "ramp_to_room": false,
        "accessible_restrooms": true
      },
      "sources": [
        {
          "type": "official",
          "url": "https://www.gov.br/ancine/pt-br/oca/cinema/arquivos.csv/salas-de-exibicao-e-complexos.csv/@@download/file",
          "note": "Cadastro mensal da ANCINE: \"CINEMARK SHOPPING IGUATEMI SP SALA 05\", registro 5006051, em funcionamento; 66 assentos, 3 espaços para cadeirantes, 1 assento de mobilidade reduzida, 1 assento para pessoas obesas."
        }
      ],
      "notes": "Conforto: Poltronas reclináveis"
    },
    {
      "name": "Sala 6",
      "slug": "sala-6",
      "ancine_registry": "5006052",
      "technologies": [],
      "projection": {
        "technology": "A confirmar",
        "resolution": "A confirmar",
        "light_source": "A confirmar"
      },
      "screen": {
        "aspect_ratio": "A confirmar",
        "width_m": null,
        "height_m": null
      },
      "sound": {
        "format": "A confirmar",
        "channels": null,
        "speakers": null,
        "power_watts": null
      },
      "seats": 80,
      "accessibility": {
        "wheelchair_seats": 4,
        "reduced_mobility_seats": 1,
        "obese_seats": 1,
        "ramp_to_seats": true,
        "ramp_to_room": false,
        "accessible_restrooms": true
      },
      "sources": [
        {
          "type": "official",
          "url": "https://www.gov.br/ancine/pt-br/oca/cinema/arquivos.csv/salas-de-exibicao-e-complexos.csv/@@download/file",
          "note": "Cadastro mensal da ANCINE: \"CINEMARK SHOPPING IGUATEMI SP SALA 06\", registro 5006052, em funcionamento; 80 assentos, 4 espaços para cadeirantes, 1 assento de mobilidade reduzida, 1 assento para pessoas obesas."
        }
      ]
    }
  ]
}
