{
  "slug": "uci-plaza-sul",
  "name": "UCI Plaza Sul",
  "network": {
    "slug": "uci",
    "name": "UCI"
  },
  "city": "São Paulo",
  "state": "SP",
  "neighborhood": "Bosque da Saúde",
  "address": "Praça Leonor Kaupa – Bosque da Saúde",
  "ancine_registry": "52086",
  "last_verified": "2026-07-31",
  "rooms": [
    {
      "name": "Sala 1",
      "slug": "sala-1",
      "ancine_registry": "5006866",
      "technologies": [],
      "projection": {
        "technology": "A confirmar",
        "resolution": "A confirmar",
        "light_source": "Laser"
      },
      "screen": {
        "aspect_ratio": "A confirmar",
        "width_m": null,
        "height_m": null
      },
      "sound": {
        "format": "A confirmar",
        "channels": null,
        "speakers": null,
        "power_watts": null
      },
      "seats": 141,
      "accessibility": {
        "wheelchair_seats": 3,
        "reduced_mobility_seats": 2,
        "obese_seats": 2,
        "ramp_to_seats": true,
        "ramp_to_room": true,
        "accessible_restrooms": false
      },
      "sources": [
        {
          "type": "official",
          "url": "https://www.gov.br/ancine/pt-br/oca/cinema/arquivos.csv/salas-de-exibicao-e-complexos.csv/@@download/file",
          "note": "Cadastro mensal da ANCINE: \"UCI PLAZA SUL 1\", registro 5006866, em funcionamento; 141 assentos, 3 espaços para cadeirantes, 2 assentos de mobilidade reduzida, 2 assentos para pessoas obesas."
        }
      ]
    },
    {
      "name": "Sala 2",
      "slug": "sala-2",
      "ancine_registry": "5006867",
      "technologies": [],
      "projection": {
        "technology": "A confirmar",
        "resolution": "A confirmar",
        "light_source": "Laser"
      },
      "screen": {
        "aspect_ratio": "A confirmar",
        "width_m": null,
        "height_m": null,
        "geometry": "Plana"
      },
      "sound": {
        "format": "A confirmar",
        "channels": null,
        "speakers": null,
        "power_watts": null
      },
      "seats": 251,
      "accessibility": {
        "wheelchair_seats": 5,
        "reduced_mobility_seats": 3,
        "obese_seats": 3,
        "ramp_to_seats": true,
        "ramp_to_room": true,
        "accessible_restrooms": false
      },
      "sources": [
        {
          "type": "user_report",
          "url": "",
          "note": "Confirmado via Ingresso.com"
        },
        {
          "type": "official",
          "url": "https://www.gov.br/ancine/pt-br/oca/cinema/arquivos.csv/salas-de-exibicao-e-complexos.csv/@@download/file",
          "note": "Cadastro mensal da ANCINE: \"UCI PLAZA SUL 2\", registro 5006867, em funcionamento; 251 assentos, 5 espaços para cadeirantes, 3 assentos de mobilidade reduzida, 3 assentos para pessoas obesas."
        }
      ]
    },
    {
      "name": "Sala 3 - VIP",
      "slug": "sala-3-vip",
      "ancine_registry": "5006868",
      "technologies": [],
      "projection": {
        "technology": "A confirmar",
        "resolution": "A confirmar",
        "light_source": "Laser"
      },
      "screen": {
        "aspect_ratio": "A confirmar",
        "width_m": null,
        "height_m": null
      },
      "sound": {
        "format": "A confirmar",
        "channels": null,
        "speakers": null,
        "power_watts": null
      },
      "seats": 141,
      "accessibility": {
        "wheelchair_seats": 3,
        "reduced_mobility_seats": 2,
        "obese_seats": 2,
        "ramp_to_seats": true,
        "ramp_to_room": true,
        "accessible_restrooms": false
      },
      "sources": [
        {
          "type": "user_report",
          "url": "",
          "note": "Confirmado via Ingresso.com: sessões rotuladas como [Vip]"
        },
        {
          "type": "official",
          "url": "https://www.gov.br/ancine/pt-br/oca/cinema/arquivos.csv/salas-de-exibicao-e-complexos.csv/@@download/file",
          "note": "Cadastro mensal da ANCINE: \"UCI PLAZA SUL 3\", registro 5006868, em funcionamento; 141 assentos, 3 espaços para cadeirantes, 2 assentos de mobilidade reduzida, 2 assentos para pessoas obesas."
        }
      ]
    },
    {
      "name": "Sala 4 - VIP",
      "slug": "sala-4-vip",
      "ancine_registry": "5006869",
      "technologies": [],
      "projection": {
        "technology": "A confirmar",
        "resolution": "A confirmar",
        "light_source": "Laser"
      },
      "screen": {
        "aspect_ratio": "A confirmar",
        "width_m": null,
        "height_m": null
      },
      "sound": {
        "format": "A confirmar",
        "channels": null,
        "speakers": null,
        "power_watts": null
      },
      "seats": 141,
      "accessibility": {
        "wheelchair_seats": 3,
        "reduced_mobility_seats": 2,
        "obese_seats": 2,
        "ramp_to_seats": true,
        "ramp_to_room": true,
        "accessible_restrooms": false
      },
      "sources": [
        {
          "type": "press",
          "url": "https://telaviva.com.br/29/10/2025/uci-cinemas-inaugura-salas-vip-de-lux-e-nova-bomboniere-no-shopping-plaza-sul-em-sao-paulo/",
          "note": "VIP DE LUX: poltronas chaise longue de couro reclináveis; inauguração out/2025"
        },
        {
          "type": "official",
          "url": "https://www.gov.br/ancine/pt-br/oca/cinema/arquivos.csv/salas-de-exibicao-e-complexos.csv/@@download/file",
          "note": "Cadastro mensal da ANCINE: \"UCI PLAZA SUL 4\", registro 5006869, em funcionamento; 141 assentos, 3 espaços para cadeirantes, 2 assentos de mobilidade reduzida, 2 assentos para pessoas obesas."
        }
      ],
      "notes": "Conforto: Poltronas reclináveis"
    },
    {
      "name": "Sala 5",
      "slug": "sala-5",
      "ancine_registry": "5006870",
      "technologies": [],
      "projection": {
        "technology": "A confirmar",
        "resolution": "A confirmar",
        "light_source": "Laser"
      },
      "screen": {
        "aspect_ratio": "A confirmar",
        "width_m": null,
        "height_m": null
      },
      "sound": {
        "format": "A confirmar",
        "channels": null,
        "speakers": null,
        "power_watts": null
      },
      "seats": 141,
      "accessibility": {
        "wheelchair_seats": 3,
        "reduced_mobility_seats": 2,
        "obese_seats": 2,
        "ramp_to_seats": true,
        "ramp_to_room": true,
        "accessible_restrooms": false
      },
      "sources": [
        {
          "type": "official",
          "url": "https://www.gov.br/ancine/pt-br/oca/cinema/arquivos.csv/salas-de-exibicao-e-complexos.csv/@@download/file",
          "note": "Cadastro mensal da ANCINE: \"UCI PLAZA SUL 5\", registro 5006870, em funcionamento; 141 assentos, 3 espaços para cadeirantes, 2 assentos de mobilidade reduzida, 2 assentos para pessoas obesas."
        }
      ]
    },
    {
      "name": "Sala 6",
      "slug": "sala-6",
      "ancine_registry": "5006871",
      "technologies": [],
      "projection": {
        "technology": "A confirmar",
        "resolution": "A confirmar",
        "light_source": "Laser"
      },
      "screen": {
        "aspect_ratio": "A confirmar",
        "width_m": null,
        "height_m": null
      },
      "sound": {
        "format": "A confirmar",
        "channels": null,
        "speakers": null,
        "power_watts": null
      },
      "seats": 217,
      "accessibility": {
        "wheelchair_seats": 5,
        "reduced_mobility_seats": 3,
        "obese_seats": 3,
        "ramp_to_seats": true,
        "ramp_to_room": true,
        "accessible_restrooms": false
      },
      "sources": [
        {
          "type": "official",
          "url": "https://www.gov.br/ancine/pt-br/oca/cinema/arquivos.csv/salas-de-exibicao-e-complexos.csv/@@download/file",
          "note": "Cadastro mensal da ANCINE: \"UCI PLAZA SUL 6\", registro 5006871, em funcionamento; 217 assentos, 5 espaços para cadeirantes, 3 assentos de mobilidade reduzida, 3 assentos para pessoas obesas."
        }
      ]
    }
  ]
}
