{
  "slug": "cinemark-patio-higienopolis",
  "name": "Cinemark Pátio Higienópolis",
  "network": {
    "slug": "cinemark",
    "name": "Cinemark"
  },
  "city": "São Paulo",
  "state": "SP",
  "neighborhood": "Higienópolis",
  "address": "Av. Higienópolis – Higienópolis",
  "ancine_registry": "2536",
  "last_verified": "2026-07-31",
  "rooms": [
    {
      "name": "Sala 1",
      "slug": "sala-1",
      "ancine_registry": "5000300",
      "technologies": [],
      "projection": {
        "technology": "A confirmar",
        "resolution": "A confirmar",
        "light_source": "A confirmar"
      },
      "screen": {
        "aspect_ratio": "A confirmar",
        "width_m": null,
        "height_m": null
      },
      "sound": {
        "format": "A confirmar",
        "channels": null,
        "speakers": null,
        "power_watts": null
      },
      "seats": 118,
      "accessibility": {
        "wheelchair_seats": 4,
        "reduced_mobility_seats": 1,
        "obese_seats": 2,
        "ramp_to_seats": true,
        "ramp_to_room": false,
        "accessible_restrooms": true
      },
      "sources": [
        {
          "type": "official",
          "url": "https://www.gov.br/ancine/pt-br/oca/cinema/arquivos.csv/salas-de-exibicao-e-complexos.csv/@@download/file",
          "note": "Cadastro mensal da ANCINE: \"PÁTIO HIGIENÓPOLIS 1\", registro 5000300, em funcionamento; 118 assentos, 4 espaços para cadeirantes, 1 assento de mobilidade reduzida, 2 assentos para pessoas obesas."
        },
        {
          "type": "metadata",
          "url": "https://www.ingresso.com/cinema/cinemark-patio-higienopolis",
          "note": "Sala 1 observada na programação do Ingresso.com em 31/07/2026."
        }
      ]
    },
    {
      "name": "Sala 2",
      "slug": "sala-2",
      "ancine_registry": "5000301",
      "technologies": [],
      "projection": {
        "technology": "A confirmar",
        "resolution": "A confirmar",
        "light_source": "A confirmar"
      },
      "screen": {
        "aspect_ratio": "A confirmar",
        "width_m": null,
        "height_m": null
      },
      "sound": {
        "format": "A confirmar",
        "channels": null,
        "speakers": null,
        "power_watts": null
      },
      "seats": 121,
      "accessibility": {
        "wheelchair_seats": 4,
        "reduced_mobility_seats": 1,
        "obese_seats": 2,
        "ramp_to_seats": true,
        "ramp_to_room": false,
        "accessible_restrooms": true
      },
      "sources": [
        {
          "type": "official",
          "url": "https://www.gov.br/ancine/pt-br/oca/cinema/arquivos.csv/salas-de-exibicao-e-complexos.csv/@@download/file",
          "note": "Cadastro mensal da ANCINE: \"PÁTIO HIGIENÓPOLIS 2\", registro 5000301, em funcionamento; 121 assentos, 4 espaços para cadeirantes, 1 assento de mobilidade reduzida, 2 assentos para pessoas obesas."
        },
        {
          "type": "metadata",
          "url": "https://www.ingresso.com/cinema/cinemark-patio-higienopolis",
          "note": "Sala 2 observada na programação do Ingresso.com em 31/07/2026."
        }
      ]
    },
    {
      "name": "Sala 3",
      "slug": "sala-3",
      "ancine_registry": "5000302",
      "technologies": [],
      "projection": {
        "technology": "A confirmar",
        "resolution": "A confirmar",
        "light_source": "A confirmar"
      },
      "screen": {
        "aspect_ratio": "A confirmar",
        "width_m": null,
        "height_m": null
      },
      "sound": {
        "format": "A confirmar",
        "channels": null,
        "speakers": null,
        "power_watts": null
      },
      "seats": 116,
      "accessibility": {
        "wheelchair_seats": 3,
        "reduced_mobility_seats": 1,
        "obese_seats": 2,
        "ramp_to_seats": true,
        "ramp_to_room": false,
        "accessible_restrooms": true
      },
      "sources": [
        {
          "type": "official",
          "url": "https://www.gov.br/ancine/pt-br/oca/cinema/arquivos.csv/salas-de-exibicao-e-complexos.csv/@@download/file",
          "note": "Cadastro mensal da ANCINE: \"PÁTIO HIGIENÓPOLIS 3\", registro 5000302, em funcionamento; 116 assentos, 3 espaços para cadeirantes, 1 assento de mobilidade reduzida, 2 assentos para pessoas obesas."
        },
        {
          "type": "metadata",
          "url": "https://www.ingresso.com/cinema/cinemark-patio-higienopolis",
          "note": "Sala 3 observada na programação do Ingresso.com em 31/07/2026."
        }
      ]
    },
    {
      "name": "Sala 4",
      "slug": "sala-4",
      "ancine_registry": "5000303",
      "technologies": [],
      "projection": {
        "technology": "A confirmar",
        "resolution": "A confirmar",
        "light_source": "A confirmar"
      },
      "screen": {
        "aspect_ratio": "A confirmar",
        "width_m": null,
        "height_m": null
      },
      "sound": {
        "format": "A confirmar",
        "channels": null,
        "speakers": null,
        "power_watts": null
      },
      "seats": 97,
      "accessibility": {
        "wheelchair_seats": 3,
        "reduced_mobility_seats": 1,
        "obese_seats": 2,
        "ramp_to_seats": true,
        "ramp_to_room": false,
        "accessible_restrooms": true
      },
      "sources": [
        {
          "type": "official",
          "url": "https://www.gov.br/ancine/pt-br/oca/cinema/arquivos.csv/salas-de-exibicao-e-complexos.csv/@@download/file",
          "note": "Cadastro mensal da ANCINE: \"PÁTIO HIGIENÓPOLIS 4\", registro 5000303, em funcionamento; 97 assentos, 3 espaços para cadeirantes, 1 assento de mobilidade reduzida, 2 assentos para pessoas obesas."
        },
        {
          "type": "metadata",
          "url": "https://www.ingresso.com/cinema/cinemark-patio-higienopolis",
          "note": "Sala 4 observada na programação do Ingresso.com em 31/07/2026."
        }
      ]
    },
    {
      "name": "Sala 5",
      "slug": "sala-5",
      "ancine_registry": "5000304",
      "technologies": [],
      "projection": {
        "technology": "A confirmar",
        "resolution": "A confirmar",
        "light_source": "A confirmar"
      },
      "screen": {
        "aspect_ratio": "A confirmar",
        "width_m": null,
        "height_m": null
      },
      "sound": {
        "format": "A confirmar",
        "channels": null,
        "speakers": null,
        "power_watts": null
      },
      "seats": 216,
      "accessibility": {
        "wheelchair_seats": 5,
        "reduced_mobility_seats": 3,
        "obese_seats": 3,
        "ramp_to_seats": true,
        "ramp_to_room": false,
        "accessible_restrooms": true
      },
      "sources": [
        {
          "type": "official",
          "url": "https://www.gov.br/ancine/pt-br/oca/cinema/arquivos.csv/salas-de-exibicao-e-complexos.csv/@@download/file",
          "note": "Cadastro mensal da ANCINE: \"PÁTIO HIGIENÓPOLIS 5\", registro 5000304, em funcionamento; 216 assentos, 5 espaços para cadeirantes, 3 assentos de mobilidade reduzida, 3 assentos para pessoas obesas."
        },
        {
          "type": "metadata",
          "url": "https://www.ingresso.com/cinema/cinemark-patio-higienopolis",
          "note": "Sala 5 observada na programação do Ingresso.com em 31/07/2026."
        }
      ]
    },
    {
      "name": "Sala 6",
      "slug": "sala-6",
      "ancine_registry": "5000305",
      "technologies": [],
      "projection": {
        "technology": "A confirmar",
        "resolution": "A confirmar",
        "light_source": "A confirmar"
      },
      "screen": {
        "aspect_ratio": "A confirmar",
        "width_m": null,
        "height_m": null
      },
      "sound": {
        "format": "A confirmar",
        "channels": null,
        "speakers": null,
        "power_watts": null
      },
      "seats": 239,
      "accessibility": {
        "wheelchair_seats": 5,
        "reduced_mobility_seats": 3,
        "obese_seats": 3,
        "ramp_to_seats": true,
        "ramp_to_room": false,
        "accessible_restrooms": true
      },
      "sources": [
        {
          "type": "official",
          "url": "https://www.gov.br/ancine/pt-br/oca/cinema/arquivos.csv/salas-de-exibicao-e-complexos.csv/@@download/file",
          "note": "Cadastro mensal da ANCINE: \"PÁTIO HIGIENÓPOLIS 6\", registro 5000305, em funcionamento; 239 assentos, 5 espaços para cadeirantes, 3 assentos de mobilidade reduzida, 3 assentos para pessoas obesas."
        },
        {
          "type": "metadata",
          "url": "https://www.ingresso.com/cinema/cinemark-patio-higienopolis",
          "note": "Sala 6 observada na programação do Ingresso.com em 31/07/2026."
        }
      ]
    }
  ]
}
